{
  "schema_version": "1.0",
  "regime": "baseline-random/china-qin",
  "mode": "centralized",
  "nodes": [
    {
      "id": "emperor",
      "label": "皇帝",
      "functional_role": "coordinator"
    },
    {
      "id": "chengxiang",
      "label": "丞相",
      "functional_role": "management"
    },
    {
      "id": "taiwei",
      "label": "太尉",
      "functional_role": "engineering"
    },
    {
      "id": "yushi-censor",
      "label": "御史大夫",
      "functional_role": "review"
    },
    {
      "id": "tingwei-justice",
      "label": "廷尉",
      "functional_role": "legal"
    },
    {
      "id": "zhisu-finance",
      "label": "治粟内史",
      "functional_role": "data"
    },
    {
      "id": "shaofu-works",
      "label": "少府",
      "functional_role": "devops"
    }
  ],
  "edges": [
    {
      "from": "yushi-censor",
      "to": "chengxiang",
      "kind": "command"
    },
    {
      "from": "emperor",
      "to": "chengxiang",
      "kind": "command"
    },
    {
      "from": "emperor",
      "to": "zhisu-finance",
      "kind": "review"
    },
    {
      "from": "shaofu-works",
      "to": "zhisu-finance",
      "kind": "command"
    },
    {
      "from": "shaofu-works",
      "to": "taiwei",
      "kind": "command"
    },
    {
      "from": "tingwei-justice",
      "to": "taiwei",
      "kind": "command"
    },
    {
      "from": "emperor",
      "to": "yushi-censor",
      "kind": "review"
    },
    {
      "from": "emperor",
      "to": "tingwei-justice",
      "kind": "command"
    },
    {
      "from": "chengxiang",
      "to": "emperor",
      "kind": "command"
    },
    {
      "from": "zhisu-finance",
      "to": "yushi-censor",
      "kind": "command"
    },
    {
      "from": "chengxiang",
      "to": "zhisu-finance",
      "kind": "command"
    },
    {
      "from": "zhisu-finance",
      "to": "taiwei",
      "kind": "command"
    },
    {
      "from": "tingwei-justice",
      "to": "chengxiang",
      "kind": "command"
    },
    {
      "from": "chengxiang",
      "to": "taiwei",
      "kind": "review"
    },
    {
      "from": "shaofu-works",
      "to": "yushi-censor",
      "kind": "command"
    },
    {
      "from": "chengxiang",
      "to": "taiwei",
      "kind": "command"
    },
    {
      "from": "shaofu-works",
      "to": "emperor",
      "kind": "review"
    },
    {
      "from": "yushi-censor",
      "to": "shaofu-works",
      "kind": "command"
    }
  ]
}
